{
  "report_format_version": 1,
  "plugin_version": "1.2.0",
  "project": {
    "name": "acme-api",
    "repo_url": "https://github.com/acme/acme-api",
    "stack": {
      "language": "typescript",
      "framework": "nestjs",
      "orm": "prisma"
    }
  },
  "run": {
    "commit_sha": "9f3c1ad",
    "branch": "main",
    "started_at": "2026-08-30T14:12:00Z",
    "finished_at": "2026-08-30T14:13:20Z"
  },
  "summary": {
    "critical": 2,
    "high": 5,
    "medium": 9,
    "low": 3,
    "info": 4
  },
  "findings": [
    {
      "module": "secrets-audit",
      "rule_id": "hardcoded-aws-key",
      "severity": "critical",
      "title": "Hardcoded AWS access key",
      "file_path": "src/config/aws.ts",
      "line_start": 12,
      "line_end": 12,
      "evidence": {
        "snippet_redacted": "const key = '<redacted AWS key>'",
        "match": "AWS access key (redacted)"
      },
      "remediation": "Move the key to an environment variable and rotate it.",
      "frameworks": ["owasp", "soc2"]
    },
    {
      "module": "phi-pii",
      "rule_id": "phi-in-logs",
      "severity": "critical",
      "title": "Patient identifiers written to application logs",
      "file_path": "src/patients/patients.service.ts",
      "line_start": 48,
      "line_end": 52,
      "evidence": {
        "snippet_redacted": "this.logger.info(`loaded patient <redacted patient identifier>`)",
        "match": "PHI/PII in logger statement (redacted)"
      },
      "remediation": "Remove PHI fields from log statements; log only opaque record IDs through the audit service.",
      "frameworks": ["hipaa", "soc2"]
    }
  ],
  "control_results": [
    {
      "framework": "owasp",
      "control": "A02",
      "status": "fail",
      "finding_rule_ids": ["hardcoded-aws-key"]
    },
    {
      "framework": "hipaa",
      "control": "164.312(b)",
      "status": "fail",
      "finding_rule_ids": ["phi-in-logs"]
    },
    {
      "framework": "soc2",
      "control": "CC6.1",
      "status": "pass",
      "finding_rule_ids": []
    }
  ]
}
